2360850	2363940	Оказалось, что все годы они без остановки мутировали,

2364000	2365620	чтобы однажды сделать свою жизнь,

2366020	2366740	что дышку лучше.

2367560	2369220	И вот во время очередной мутации,

2369920	2372020	одна маленькая бактерия, после того, где тана,

2372620	2372980	поняла,

2373500	2376060	что цитратно отре, в котором все они плывают,

2376680	2377320	тоже можно есть.

2378020	2381100	Это все равно, что мы прийти в на Марс и вулиционируем настолько,

2381480	2383040	что сможем есть не только картошку,

2383560	2384600	но и марсионский грун,

2384720	2385860	в котором ее выращиваем.

2386480	2386900	Табактерия,

2387240	2390680	как муравей, который случайно нашел новую удачную тропинку.

2391440	2393800	Гновение спустя все остальные пошли по ней,

2394140	2397300	и это раскрел нам весь бактериальный алгоритм,

2397420	2398840	который работает в два шага.

2399280	2400840	Шаг первый раз нажаясь,

2400860	2402780	как можно быстрее, чтобы хотя бы один,

2403420	2406140	потомок из триллионов получил мутацию шаг второй нижайденчей.

2406620	2407720	Как только получил мутацию,

2408100	2410980	тут же передавайся, помущу гризантального переносы генов,

2411420	2412560	это мутацию всем вокруг.

2412800	2413740	Гризантального, значит,

2414080	2415600	внутри одного поколения.

2416040	2418460	То есть не потомком, обратим с сестерми.

2419680	2420080	Представьте,

2420480	2422020	что вам понравилось, мы сегодня с вид глаз,

2422380	2425520	вы жмёте мне, да трагивайте, даже другие, и вот у вас такой же глаз.

2425760	2427040	Вот так работает у бактерии.

2427560	2429020	То есть, как-то вот так.

2429220	2430880	Используя всего лишь эти два правила,

2431080	2434320	в 2014 году бактерии для черда пошли еще дальше.

2434660	2435180	Те из них,

2435540	2437040	что не научились есть сетрат,

2437480	2439700	стали есть продукты жизни, деятельности тех,

2440020	2440820	кто есть сетрат.

2441600	2444260	То есть, вместо конкуренции они выбрали колоборацию,

2444940	2448080	и в колбе зародилась уникальная экосистема,

2448080	2450220	где одни подъедают за другими.

2450420	2451420	Это есть и валюция.

2452360	2455160	Она научила бактерии зебираться в кальмарах, свититься,

2455940	2456720	дикторывать мухом,

2457060	2457720	с кем спарётся.

2458620	2463820	Нахадить новые источники пищи и даже создавать сложные сообщества в закрытых колбах.

2465020	2466980	Испермент речь речь речь речь до линский доказал,

2467060	2470100	что и валюция происходит не только под влиянием внешних событий.

2471420	2472680	Вроде бы, падение омитя Рита.

2473820	2475320	И валюция идет всегда.

2476280	2479880	И прямо сейчас, похоже, эксперимент происходит уже в мировом масштабе.

2481060	2484800	В океане плавает огромное количество колп с собственной и валюцией внутри.

2485440	2487500	Это подбутылки и разные другой пластик.

2488080	2489980	На нем развивается особые биоплёнки,

2490000	2491860	которые так называются пластесферы.

2492460	2496900	Это уникальный экосистем, где вся пищевается почка перестралась под жизнь пластики.

2497580	2499740	Обактерий научились и есть сам пластик.

2500420	2504300	Они вырабатали фирменты, которые буквально разрывают его полимерные цепочки.

2504960	2508600	В итоге для каждого популярного вида пластика уже нашла из бактерия,

2508740	2509780	которые его разлагают.

2510080	2511080	Возможно также,

2511380	2512620	как 8 тысяч лет назад,

2513120	2514240	мы забирали обчёл мет,

2514480	2516060	мы научимся забирать у бактерии

2516620	2517520	их противопластиковые.

2518020	2523180	И валюция этой есть самый большой и мощный раевую интеллект на планете.

2524080	2528100	Именно благодаря ему омёбы могут приночаться в слизивика.

2529620	2530760	Муровим могу строить масты,

2530880	2532620	а в чёлое обучают друг друга на языке танцев.

2534100	2538740	А горит мэтого раевого интеллекта помогает развиваться всему же в обуму на планете.

2539900	2540400	А может быть,

2541520	2542860	из-за ее пределами тоже.

2543840	2546220	В Танисловлем в романе не победим и рассказывает,

2546440	2547340	как на планете Раги С3,

2547860	2550260	происходило и валюция до вно-забытых там роботов.

2551240	2553760	Первое, образовывали огромные витвисты из труктуры.

2554520	2556340	Похоже на подземной небоскребы.

2556960	2559240	В тарые уменьшили сестали похоже на растения.

2559840	2564640	На конец третьей решили брать числом и пройти из письчисленный рой из робомуха.

2565140	2566800	Именно он и стал непобедимым.

2567360	2571820	Робомушки выводили из строя с самым мощную технику с защиты из силовых полей,

2571920	2574840	прямо как муравья, который толпой прогрозает птичей и цо.

2575060	2576220	В результате люди поединят,

2576600	2577680	что Роем не враг.

2578500	2581220	В процессе эволюции он стал частью природных сил планеты,

2581660	2583460	а со стихи бороться без смысла.

2584320	2585460	Просто нужно признать,

2585760	2588560	что не все в этой мире создана для нас.

2589800	2591300	Но мы с вами теперь понимаем,

2591780	2595000	что часто выглядит не быть небольшим окроходным,

2596000	2597140	не сложным,

2597560	2598140	а многочисленным.

2599360	2602760	Возможно мы сами являемся частью рывого интеллекта.

2603260	2605320	Наши общества, потому что ведет себя как организм,

2605900	2608300	который непохожно каждого отдельного человека,

2608420	2613060	но способен исследовать этот микромир из запускати ракеты в космос.

2614300	2615360	Поэтому подумайте об этом.

2617000	2619080	И не забывайте, ставить это видео лайк,

2619160	2621080	ведь мы перелопать или кучу материал,

2621160	2624220	отбросив все лишнее, оставив самое главное и интересное.

2626050	2628160	Напишите, изменился со ли у вас взгляд

2629500	2630520	на микромир вокруг вас,

2630740	2631720	не убивает ему ровьёв,

2632540	2633420	мою личное пожелание,

2634340	2635580	через лопу, не жигите

2636400	2637180	и

2637920	2638960	оцените мою бордов, но я дадести.

2639620	2641420	И как обычно прокачивте в своей мозге.

2642180	2642340	Пока!

2646170	2648300	Ребят можно еще с хорошими новостями.

2648720	2648840	Значит,

2648860	2651980	у нас есть дополнительное место в нашем экспедицию в интеракте.

2652200	2654420	Он выбил еще одно явто,

2654640	2655920	который поедет вместе с нами.

2656240	2657140	Одну в быстро заполни,

2657140	2660020	желающий хоть много, мы убили еще одно и там 7 место еще есть.

2660460	2660840	Пожалуйста,

2661480	2662400	по резьете неайтесь.

2662700	2666040	Это не только пропингвинев кетов и красивые виды антрактида,

2666060	2667520	это еще закрыт гештайт.

2668080	2672220	Во-первых, побывать на еще одном континенте можно на всех континтов по вас своей жизни.

2672380	2675140	И вот это прекрасно возможность и это как дойти доверяста.

2675360	2675940	Это вызов,

2676020	2678200	потому что до антрактида не просто добраться.

2679560	2681520	С нами получится еще и интересно.

2682120	2684740	Поэтому присоединяйтесь эти 7 место очень быстро,

2684760	2687480	могу закончиться и обязательно помните,

2687620	2688600	что там есть интернет.

2688880	2694620	То есть вы будете плать и у вас будет всегда антрадь можно работать и не отрывайся от работы,

2694740	2696420	как бы смотреть на пингбинов.

2697300	2699280	И пребираться, делай себя галочку.

2699940	2702640	До встречи на крови света! Всем подроби с посылкой в описании.

2702740	2703680	Даже если вы не хотите,

2703680	2704640	просто посмотрите это красиво!