0	4680	СТУК

5380	5920	Да.

6420	7360	Это борода.

8020	11020	Я уже спрашивал вас в моем СИГРАМ Каналии.

11020	13900	Вы сказали океи, го, вот только так надо снимать.

14080	14800	А через просидю вас,

14840	16580	зрители новичевых, как вам моя борода.

16820	17840	Прошу вас и не ругать,

18260	19730	она молода, она стесняется.

19940	23100	Я очень неловко и очень неловко прямо сейчас.

24450	25460	И как видите,

25780	26960	у меня даже тримеры ты не был.

27060	27980	Я не был готов, бороде.

28540	30380	Вообще напишите, как моя борода, а я начинаю выпуск.

31520	33240	И у меня для вас вопрос,

33360	35240	кто из вас был в омске.

35340	37200	Даже если вы не были там не дня,

37280	39880	вы легко запомните с хему их не тро.

40460	40980	Вот она.

41480	43180	Библиотека имени пушкина.

43600	46020	Да, всего одна станция, и с нее никуда не уедешь,

46180	48020	и да не от куда не выберешься.

48140	50120	Затевнее побелечку не получится.

50360	50880	Ведь она

52320	52980	законсировирована в Москве.

53200	53980	Такой проблем и нет.

54120	57020	Здесь открывается до десяти станции каждый год.

57380	59880	Вот не поверите, но я, когда захожу в метро до сих пор,

59940	63200	ориентируюсь вот по этой схеме из 2010-го с одной кольцевой.

63340	65000	Хотя на самом деле метро выглядит вот так,

65220	66220	и это за 15 лет.

66520	67040	А вот так,

67040	69260	подземка должна выглядеть в 2000-м году.

69340	71060	Представьте целый отдел инженеров.

71420	71700	Сидит,

71880	74720	это сочиняет кулдабы и впихнуть очередную ветку.

75500	79560	Им нужны учить в плотность населения нагрузку на транспорте Особнительон шавта.

80300	82560	Сложная лагистическая задача,

83000	83420	с которой

84340	85920	справится даже...

85920	86020	Плеси.

86380	89400	Итак, в вашем вниманию физором много главой.

89460	90060	Слизивикой,

90060	92580	главная звезда, науч попо последних десят лет.

92960	93740	Это не растение.

94100	95860	Не животное и даже не гриб.

96400	98860	Он что-то вроде амёбы, который доказывает,

99340	100620	что чтобы быть умным.

101140	101800	Не нужен мозг.

102240	102720	Услизивика,

103020	103640	его тупанет.

104060	108520	Но он за сутки выспроязвял машуты всех железных дорог вокруг токе,

108600	109160	а только в думайтесь.

109380	110220	Аккуна-то сделал?

111240	112360	Просто хотел есть.

112740	115900	Слизивик любит овсянку и не любит солнечный свет.

116140	118080	Эти два факта учёны и использовали.

118420	119660	Они взяли карту токе.

119980	122140	В местах станции городов разложили офсянку,

122460	123800	а там где горы и озера,

124000	127100	через которые нельзя строить светили слизивику и ярким светом.

127480	128620	Уже через несколько часов,

128820	131380	в слизивик начал тянуть кейде своей цеплазменной тяже.

131940	132700	Постипенно.

133180	135480	Он заполнил все пространство виновсшего еду.

135980	139700	Вместе с питательными веществами внутреннего стало перетекать информация.

140180	143540	Совсем скоро из всех маршрутов остались только кратчайшие,

143900	145880	а остальные буквально растворились.

146300	147140	Карта готова.

147440	150600	Когда ее наложение на существующую сетху железных дорог в токе,

150680	153500	оказалось, что они почти полностью совпали.

153900	154300	То есть то,

154540	156140	что инженер, проектировали годами,

156640	158040	слизивик воспроязвивал засутки.

158940	159660	А как это возможно?

160860	161380	Дело в том,

161680	164180	что ты за у людей и амёб были похожими.

164540	166360	У инженеров задачи проложить линии,

166540	168120	затратив не ему материалов.

168620	172180	У слизивикат добраться до еды используя минимум своего тела.

172540	175040	Это как ночью дойти до холодильника не включаем мозг,

175440	177260	ведь у слизивика мозг и нет.

177820	179400	Пока мы думаем, физорум действует.

179960	183240	По такому же принципу он воспроязвивал железные дороги британи,

183500	186240	испани, португали и кучи других стран.

186580	188640	Его даже хотели использовать как архиолога.

188800	188900	Показывать,

189560	191320	если звику карту Ривской империи,

191460	194460	а он предсказывает, как могла бы выглядеть дорогами между городами.

194760	197600	В этих местах вы устраивает и раскопки и находите.

197920	200180	Тут самый дорогу, который предсказал слизивик.

200600	202020	Хоть в лаберинте его заточить,

202200	203460	он всё равно найдет из него выход.

203840	206540	Они слишком немного для одной амёпы переростка.

206840	208080	А кто вам сказал,

208280	209020	что она здесь одна?

209460	211540	Физорум неспростанно называют многоглавом.

212160	214660	Когда-то это ложится плесени,

215020	216700	состояла из миллионов отдельно хосабиль.

217140	218980	Эти белые точки, тупые амёбы,

219400	221280	которые бегают туда сюда пожарая субстрад.

221600	224880	Но когда еда заканчивается и наступает тяжелое времена,

225440	227380	они стекаются в единой организм.

227880	228600	Слизивика,

228880	230160	и вот он уже не так глуп,

230560	233720	строит маршруты и даже обладает подобие им памяти.

234120	237560	Думаете, слизивик, способен на интеллектуальный подвиги только радииды?

238720	239280	Ах, в шевинисты,

239600	240580	вы его не дается и не выйти.

241060	241800	Он способен ещё.

242140	242930	И ради размножения.

243160	243260	Поэтому,

243940	245860	когда он чувствует, что конец близок,

246240	249420	он отращивает на теле капсулы с потомством похожие на грибы.

249780	251460	Но трених единственные клетки,

251860	255620	которые выживут, они легкие и ветер унесёт их в другую часть леса.

255920	256400	Подальше,

256780	259060	одерьмо в ухусловии, в которых жил слезивик.

259200	259900	Теперь его дети,

260260	261060	тупые амёбы,

261400	263320	проживут лучшую жизнь, чем он сам.

263620	265940	А вот теперь самое время задаться вопросом.

267900	270360	Что вообще происходит?

270800	271480	Почему это веден,

271540	272800	называется рывой интеллект?

273040	274120	А вы, несколько минут,

274520	276760	слушайте, захватывающую историю про слезивик,

276940	277240	а?

277240	280000	Всё потому, что рывы мы интеллекта называют его поведение.

280980	287080	И для рывого интеллекта не нужен какой-либо мозг или какой-нибудь один единый центр принятия решений.

287500	287800	Не нужен.

288400	291280	Десятки тупых амёп слеваются в умного слезивика.

291440	294320	Тысячи муравьёв строит мастые плоты и собственных тел.

294520	296920	Термины возводят целые города в пустыне.

297140	299140	В тице летают сложенный стай,

299340	302240	а рыбы, к сиками вводят в супер крупных хищников,

302460	303560	чтобы технисъели.

304000	304900	Разные существа,

304900	309940	как транспорми, рассобираются вместе, чтобы выйти на качественно другой уровень жизни.

310560	313140	Да, друзья, на нашей планете в разных условиях

313140	315560	и в совершенно-разном масштабе миллионы

316140	317580	глупых организмов собираясь вместе,

318240	321500	обретают нечто напоминающая разум.

322140	322880	Разум, Рое.

325440	329300	Сейчас мы узнаете, для какой задачи не хватит всего времени на Земле.

329360	330800	Как заставить муравь я думать,

331020	333800	что он умер, а потом вернулся вставу света, что происходит,

334320	337420	когда алгоритмы с боят умиллионов на секомах сразу,

337460	339300	как в пустыне построить дом,

339520	341200	который будет охлаждать ещё сам себя,

341300	343440	как перевести на русский язык в чел.

343600	347100	Что они там нам говорят и как объясняют друг другу углы и расстояния?

347160	349360	Почему пчелом нельзя смотреть в зеркало?

349500	352660	Зачем кольмары во время охоты имитируют свецвёс?

352780	356240	Так бактерии в кишечнике выбирают хозяевом половых партнёров,

356360	362380	на что похож самое огромные в мире интеллик и как своими глазами увидеть и валютцию в бутылке.

362780	365400	Это будет очень интеллектуайный выпуск.

366160	367060	Садитесь по удобней.

385540	390440	ДИНАМИЧНАЯ МУЗЫКА

392800	393180	Где я?

395120	397440	И почему это странно, а дет,

398500	399460	персиски ковры,

399860	400440	интерьеры,

402140	402520	пуфле,

402940	403200	сузуки?

405440	409180	Задумайся, когда-нибудь, как сложно было арендовать подобное жилье, допустим,

409480	410220	150 лет назад.

410780	412480	А чало нужно было

413160	413840	упеть газету.

416660	420300	Вот шести комнатная квартира с водопроводом по вырымолокеем.

420360	421800	Выкделана, примерно вот так.

422100	423900	Но были варианты по проще, например,

424420	425020	только комната.

425380	426040	Ещё проще,

426160	427300	тогда угл в комнате.

427520	428700	Не хватает даже на угл,

428980	431800	тогда для вас в койка или даже половина койки.

432020	434020	Это минимальная гиденица жилья.

434340	436200	Не умеете читать в не страшных,

436260	438580	большинство в то время тоже не умеет читать.

438980	441680	Поэтому для них на окнах веселец специальной нестки.

442100	443980	Сини для сьема целые квартиры.

444180	445460	Белый для комнаты,

445620	447480	а зеленый для угла или койки.

447740	449100	Уожжи уже в советском союзе,

449300	451240	с просто надачой квартиру тоже был высокий,

451580	453900	но сдавать в рендов уже было нельзя.

454660	458300	Поэтому те, кто в командировках и туристы, селились в гостиницах,

458840	462040	а если хочешь квартиру или дом дает не в отпуске приезжай зимой,

462260	463920	оставляя залог на свой страх риск.

464220	470020	Все эти нерепые проблемы остались в прошлом и для этого выпуска мы сняли вот такой прекрасный эксклюзивный дом.

470180	471220	Для того, чтобы показать вам,

471820	473960	что на яндекс путешествий можно сеть что угодно.

474280	474540	Ателя,

474720	477620	а портаменты или такие необычные дома.

477880	481280	Вот собрались вынавох одной и всталицу закатов нижний Новгород.

481740	483440	Можете поселиться в чесень комателе?

483920	487180	Или выборьте апартамента на набережные и жить почти как местные?

487560	488920	А если хотите как в старину,

489180	491340	вам доступен целый кубпеческий клуб.

491660	495840	Для выбора оптимального рента всегда можно воспользоваться рейтингом и фильтрами.

496060	499980	А платить вы все это можете любое российское карты без уловок и хитрых с тем,

500220	502320	а заодно получить кижбок не только от банка,

502520	504120	но еще и от яндекс путешествий.

504360	507140	Они возвращают до 20% баллоны плюса.

507460	508120	Это в охвозе,

508420	511180	чтобы вызвать таксишку до рапорта и обратно.

511520	514320	Это как если бы выступить на затк стяли бы квартиру,

514640	516940	а кожба к им получили бы еще и из вовщика.

517380	522960	Переходите в посылке в описании и снимайте отели и опартаменты на любой вкус на яндекс путешествий.

523800	525560	А газеты прикольно горят.

533720	535440	И оп, и я слышали,

537260	537880	про задачу,

538440	539040	Кмива Яжура.

540300	542280	Это бродящий торговец на деком западе,

542440	544260	который разжает по городам,

544420	546600	продает тоник для ростоволов звены масла,

546720	549180	а от любой болезни и диксир, конечно же, молодости.

549960	550940	И другие поездные штуки.

551640	551740	Которые,

554200	554960	конечно же, не работает.

555860	557960	И если обман расхроется торговца,

559140	559420	по-весит.

559920	561320	Поэтому задачу Кмива Яжура,

561500	563680	конечно же, как можно быстрее объехать все города,

563940	565620	не посещая ни один из них дважды.

566200	568620	Звучит дисложно и решить можно просто им перебором.

568980	569360	Тем более,

569500	572300	что для 4 городов вариантов дороги всего 3,

572780	573120	а для 5,

573460	573820	12.

574540	575440	Но давайте посмотрим,

575780	576740	что же там будет дальше.

577220	579680	Для 6 городов вариантов дороги уже 60,

580120	581380	для 70, 360,

582140	583240	а для 8 городов,

583820	585440	2,5 тысячи.

585640	585980	Уже,

585980	588400	для 6,6 городов вариантов будет больше,

588420	589600	чем чистить свой вселенный.

590660	591700	Да, я понимаю,

592060	593440	очень сложно, вы-то поверить, конечно,

594180	595100	но сами посчитаете.

595360	596080	Но есть животные,

596120	597980	которые решают задачу Кмива Яжура,

598220	598680	каждый день.

599100	600000	А тогда секто это?

601200	602100	Это муравишки.

608320	608980	По отдельности,

609520	611220	каждый из них без просветнут.

612120	613560	Но вся колония вместе,

614620	615480	что правильно,

615960	616640	рывои интеллект.

616860	618180	Но в отличие от слизи Вика,

618580	619800	умровав есть свой язык.

620400	620960	Да, без звуков,

621420	621860	без слов,

622180	622540	но язык.

622800	628300	И что самое удивительное для этого языка у нас даже есть разговорник. Да,

628640	630880	и нашел его человек муравий.

631780	634940	Так, в народе, прозвали ученого Эдварда Уилсона.

635400	636540	Он первый заметил,

636560	637940	что если муравий умирает,

638480	639360	то первый и два дня,

639480	640480	на него никто не обращает внимание.

641320	643440	И только когда он начинает разлагаться,

644100	647460	другие муравьи относит его на муравьи на эклубища.

647680	648340	Велсон понял,

648480	650600	муравьи не обращают на собрата внимание,

651160	653900	потому что у них нет внимания.

654680	655980	Муравьи почти слипы ее,

656280	657640	и ориентироваются по ферамоном,

658020	660240	так что они тупы не видят мёртого собрата.

660840	663240	Но только когда он начинает пованивать,

664200	665700	они запускают процедуру по хороу.

665960	667100	На нашем человеческом это,

667100	668580	как если бы вы выбрасывали муравьи,

668600	670140	то и когда он начинает пахнуть.

670760	673620	Но о муравьи на эпохраны запускает вот этот ферамон.

674160	675400	Алиновая кислота.

676100	678160	Пацвета похожа на пацоночные масла.

678860	679620	Позапуха тоже.

679880	682140	Смерть муравья пахнет как пацоночное масло.

683020	684740	Если капнуть на него кагельку,

684960	688160	он сам пойдет на кладбище и начнет себя закапывать.

688280	689720	А как только запах вы ветрируется,

689920	691320	зомби поднимается из могилы,

691520	694060	умывается и как ни в чем не бывало и идет обратно в муравильник.

694200	697400	Но вопросов как и почему он вернулся с того свет.

697620	697740	Да,

698200	698460	абсолютно.

699040	699180	Просто.

699920	701440	Но это не все, что выяснил вылышен.

702000	703560	С помощью других ферамонов мы,

703620	706500	например, можем задавать направление движения на секомах.

706960	711840	Вы можете нарисовать дорожку любой формы и они будут стараться держаться ее между двумя узчиками.

712260	714240	И двигаться как троя бус попровода.

714680	715620	Так как можно заставить,

715940	718940	зигзагами ходить по пунктирной линии или по дуги.

719140	722420	То есть мы можем буквально контролировать поведение колонии.

722600	722700	Да,

723180	724240	при помощи ферамонов, конечно,

725220	725860	много и не скажешь,

726240	727400	но муравью много и не надо.

728480	730820	Где еда и как туда дойти, вот и все.

731620	734170	Ты как заставить муравильный шесть задачку, комбайжура.

734560	735040	Ну, жнах,

735480	737380	бутылочка, простого, советского.

738620	739640	Сладкого сиропа.

739880	740760	Инструкция простая,

740880	744160	находим муравильник и капаем 10 капель сиропа в нужных местах.

744480	746820	Первый муравиль чует еду и идет последов.

746900	748360	Помичай всю дорогу ферамонами.

748560	751160	Позелся воня немножко обошел все капли и вернулся в муравильник.

751460	752740	Потом по его следу пошли другие.

753020	753500	Но что важно,

753640	756160	каждый следующий пытался, по ним, много где-то срезать путь,

756400	757720	делая дорогу чуть чуть короче.

757980	761040	Ну, а дальше в силу вступает универсальным муравильное правило.

761200	763160	И если ты чувствуешь муравильную дорожку,

763380	764980	думать здесь нечего, да и нечем.

765460	766040	Иди по ней.

766500	772860	Такая простая установка в голове каждого отдельного муравяя и круче с шестьеренки большого муравильного рейвого интеллекта.

773300	775020	Чем для ней ферамоновает ропа,

775260	776300	тем реже по ней ходит.

776700	778480	И тем быстрее она испаряется,

778720	779620	а чем она короче,

779920	783880	тем чаще муравий пополняет ее запахом и она начинает вонять на вес лес.

784360	788160	В результате остаются самые вонючи и самые короткие пути.

788520	789620	Это как удобные тропинки,

789660	790780	по которым ходят люди,

790940	792140	обновляя их своими ступними.

792580	795940	В то время как длинные и непопулярные дороги зарастают травой.

796400	799260	Подотожа для ревого интеллекта нужно всего два условия.

799380	801120	Первая это огромная количества участников,

801440	804220	второе это средство информации,

804440	807000	которым можно будет отмениться на пример ферамоны.

