807460	807760	А кстати,

807820	809700	знаете сколько всего ферамонов у муравья?

810580	811640	2,

812280	812780	3,

813340	813620	1.

815480	815900	Окладывайте,

816340	817900	одни запускают поиски еды.

818180	819500	Другие муравильные поохрымые,

819880	820800	третье социальность.

821360	822320	Но есть среди них,

822440	825260	те, которые заставляют их собраться в мягкострух пуры.

825760	827260	Как как трансформер?

827840	828240	Короче,

828620	830300	видите сюда детей к экранам,

830620	832300	чтобы они такие штуру.

833080	835840	В этом ведрении Земля и не на воз.

836000	838020	Все это огромный комок муравьев.

838260	839220	Спасаясь от воды,

839580	841800	они степили слабками и пройтись вместе,

841960	843160	у похожая напустилин.

843500	844960	Из него можно слипить мячик,

845220	846420	можно сжимать как пружину,

846800	848260	а если попытаться разорвать комок,

848380	849580	он будет сопротивляться.

849780	852840	В природе муравьи таким образом спасаются от новодений.

853320	855400	Собираются в огромный живой плот и две недели

855760	858380	путешествуют пока их не отнесёт к безопасному берегу.

858520	860240	При этом муравии даже не задыхаются.

860460	862840	Ведь между ними всегда есть пузырьки воздуха.

863040	866400	Другая способность муравьи на воороевого интеллекта собраться в огромный мост,

866780	871240	чтобы толпой, например, забить, кого-нибудь большого типа осиная гнизду,

871460	872840	который покует опричение им мешает.

873320	873560	1,

873980	876220	1, в центре карта, конечно, муравьи проиграет осье.

877020	877120	Да.

877120	878340	Но вот колония муравьев,

878660	879640	заваят и тысячу.

880000	880200	Ось.

880460	881840	А когда вы узнаете следующий факт,

882080	884760	вы поймете, что колоний ее называют неспроста.

885320	886860	Когда европейцы покоряли Америку,

887320	890600	они не знали, чтобы пути домой везут собой новых пассажиров,

890980	892260	аргентинских муравьев.

892740	896620	Они почти не встретили конкуренции и расселились сначала в Европе,

896700	897720	а затем и по всему миру.

898180	900980	Если сегодня взять аргентинского муравья из Ипонии,

901280	902720	Испании и Новый Зеландии,

903060	904860	то они узнают друг друга по запаху,

905460	906160	и не будут воевать.

906420	906880	Всё потому,

907080	910040	что они одна мировая супер колония.

910320	913840	Эти букашки забивают числом даже муравьев в гораздо крупнее из себя,

914240	917180	а на растениях разводит тлю и мочниство червя,

917760	920160	чтобы питаться их сладенькими выделениями.

920540	925460	То есть этот витмуравьев занимается с катовостом и буквально перестраивает планету под себя.

926280	928980	Подробнее об этом мы рассказываем в нашем телеграмм канале,

929160	931280	там же ты найдешь и другие,

931520	936640	не вошедшие факты и сможешь их обсудить с друзьями с родителями с кем угодно соседями,

937140	937700	подписывайтесь.

938060	938360	Вот он,

938700	939460	пожалуйста, кюрркод,

940640	941880	это вот это удачи.

942240	944280	Подписаться сегодня на наш канал, наконец-то.

944880	945620	Жду вас там.

946020	946920	А это мой личный,

947300	947500	так и.

947760	949740	Тем более в связи с замедением YouTube,

950420	951760	уведомления о новых роликах,

951800	953260	легче будет получать оттуда,

953780	954200	подписывайтесь.

954480	954780	Итак,

955180	961700	простей алгоритмы уже сотни миллионов лет позволяет муравьям вжевать практически в любых условиях.

962340	965840	Вам интересно, что будет, если такая отложная система,

966980	967480	даст сбой,

967980	970460	последствия будут нахлен катастрофически.

971460	974000	Допустим, один муравей ошибся и сделал клюк.

974400	977140	Поэтому же следов пошел второй и тоже начал кружить.

977540	981820	На ферамоны след приходят другим уровью и так накопливается порочный круг из ошибок.

982300	983220	Это приводит к тому,

983220	986720	что тысячи осебесливаются в огромном мураве в его роти.

987160	988640	Пока не умирает от истощения.

989220	991800	Если верить записка в натуралистов Улье Мобба,

992400	994640	который за жизнь обошел весь земной шар.

994860	996880	В Гайане он увидел муравь в его роти,

996880	999080	диаметром в 3700 метров.

999600	1001120	Это больше, что дело на лужники.

1001240	1001800	Подведем и тонь.

1002160	1005660	Каждый из муравь ее фабсолютно не мовер на туп.

1006060	1007700	Но когда они собираются в раево-интеллект,

1007820	1010060	то тысячи муравь они могут решать задача,

1010240	1012700	на которой супер компьютеру человека нужен,

1013160	1014800	да не хватит даже всего времени на земле.

1015600	1019780	Но иногда этот раево-интеллект сбойет и тысячи муравьи шах,

1020280	1023100	становится жертвами великого алгоритма.

1024740	1027040	Вот так вот устроены для этого маленькая всему.

1027960	1031000	Но что, если мы сделаем сейчас из муравьев, интервертов,

1032220	1036440	следить за мыслию и оставим их в идеальном жилище,

1036620	1038360	которая не будет входить в общей свою жилище,

1038440	1039420	то чтобы будет настолько идеально,

1039540	1041400	что можно прожить хоть тысячу лет на этом жилище.

1042900	1043320	То получится,

1044200	1045800	что правильно термиты.

1049930	1054000	Вы наверняка думаете, что термит это просто крупные муравьи,

1054420	1055820	которые разумбрёвно.

1056400	1058980	Но на самом деле термиты рост в инеки Траканов.

1060180	1062440	И самое интересное, они творятся в всем не в брёвных.

1062960	1064080	В африканских и южно

1064740	1068800	-американских пустынных полях есть целые застройки вот такими термитниками.

1069300	1070120	Да это не пеньки,

1070120	1073980	они баскрёбы из писка дерева и слюны каждый высотой до 8 метров,

1074380	1075180	что в этом особенно вы.

1075800	1078560	А вы попробуйте построить себе в пусты и дома слюны и писка.

1079540	1081400	Нем солнце разогребает писок так,

1081420	1082880	что можно жарить иишинцу.

1083480	1085600	То есть буквально ставишь с коворотку и жаришь.

1085820	1087180	Через минуту будет готово,

1087580	1088780	а термитов, чтобы поджарится,

1089140	1089860	нужно и того меньше.

1090360	1091960	Покров у него настолько тонкий,

1092020	1093860	что через него видно внутриности.

1094260	1096460	То есть жара должна буквально высушивать термитов.

1097100	1098640	Но за счет рейового интеллекта,

1098680	1100280	они поняли, где в пустыне холоднее всего.

1101220	1102800	А сейчас поймете и вы.

1103580	1105080	Вот а вы с меметровый термитник,

1105340	1107880	как думаете, где у меня мы живут на секомы может тут,

1108840	1111240	тут или тут и неравномерно по всей площади.

1111820	1112640	Не один из вариантов,

1112800	1115280	они живут в огромной камере под термитником.

1116020	1119460	Это все равно, что всем обитателем, будешь холиво переселиться на парковку.

1120460	1123120	Тогда зачем нужно остальное часть?

1123940	1127680	Вы поймете, когда осознаете, что термитник от насамдели не небоскреб,

1128420	1130120	а охлаждающая башня, как у Тец.

1130480	1132360	Нем нагрятый воздух поднимается вверх,

1132480	1134920	в утягиве более прохладное из нежних помещений.

1135240	1136220	В то время как термиты,

1136440	1139360	скаролевые или чинками прохлаждаются в угловной камере.

1139940	1140680	А ночью процесс

1141200	1141860	поворачивается в спять,

1142220	1146640	что плывоздух снизу выталкивает прохладный наружу и термиты не замерзают.

1146940	1149640	То есть зимля под термитником работает как огромный поурбенк,

1149980	1151240	днем она запасает тепло,

1151540	1153280	на ночь, а ночью холодный.

1153740	1156300	И все это построено без планов и чертежей.

1156740	1158800	Просто тысячи теракашек следую зубу,

1159380	1161980	roya выполняют простые инструкции.

1162860	1163340	И все,

1164040	1169540	какие именно иногда, чтобы понять, как что-то устроено, нужно сломать это.

1170140	1172140	И вы все правильно полеученные сломаль термитника.

1172820	1175820	В спустя пары минут на место происшествия сбегается толпана сикомых.

1176420	1181380	Первый термит кладет маленький комок земли в основании разрушенной стены и помечает ферамоном,

1181880	1186240	а остальные термиты начинают класть своей комочке рядом с ней мое рентирус как распаятому ферамону.

1186500	1189480	Только так, чтобы случайно не заморовать самого себя.

1189720	1190100	Потом,

1190100	1192860	когда гора землиновально термиты,

1193000	1193820	руют в ней норы.

1194340	1195900	Они делают это буквально на бум.

1196800	1198160	Но чтобы все работало,

1198400	1199800	у них тоже есть два правила.

1200360	1202680	Первая, когда я дешево тунали, помечай его ферамоном,

1203500	1205480	а если в тоннадежарка или наоборот холодно,

1205900	1207420	не ходи и не помечай.

1208020	1211540	Так, у самых удачных тонелей ферамоны след будет самым сильным.

1212240	1213060	И второй правило,

1213380	1214380	если потом налива общения,

1214520	1216380	никто не ходит и ферамоном там не пахнет.

1216940	1217780	Значит, он плохой,

1218180	1218760	не надежный.

1219040	1221080	Его надо застроить и прорыть новый.

1221300	1221460	То есть,

1221480	1223260	понимаете, доходы, руются, но угад,

1223920	1225940	но остаются только те, которые всем нравятся.

1226620	1227580	Так, методом пропа

1228340	1230360	ошибок строится идеальный термитник.

1231080	1233500	Но каждый раз, когда коршен, например, отклеивал вверху шкутермитника,

1234380	1237360	учен на его отпинали или вода затопила термитник.

1237820	1239020	Он восстанавливается.

1239360	1241200	Но каждый раз он делает это чуть выше.

1241480	1241640	То есть,

1241940	1244200	он чуть не растает и становится все выше и выше.

1244540	1246000	Именно по этому термитникам,

1246120	1248480	который постоянно перестраивается с большим,

1248600	1249860	негод и не два.

1250380	1251480	Они несколько сотен лет.

1252060	1253920	Может, поэтому, сограда файмилия в Борсилоне,

1254220	1255300	который по форме напоминает термитник,

1255640	1257400	не могут построить уже почти 150 лет.

1257960	1260300	А, когда мы сейчас только этим рекорсменным из юар лет?

1261180	1262160	Да, этим плоским халмом.

1262980	1263480	Треси чолет.

1264000	1264520	Треси чолет.

1264520	1264620	Треси чолет.

1265340	1268680	Берите больше 34 тысяч лет.

1269060	1269160	То есть,

1269460	1272030	они старшие всей человеческой цивилизации.

1272300	1276800	За это время у нас зародилась культура на скальная живой пись и архитектура.

1277240	1284380	А термиты все 34 тысяч лет тусульца в этих холмиков и не собирается никуда уходить.

1284660	1286700	Потому что что правильно работает не трош.

1287060	1288380	Хотя я в нашем человеческом мире,

1288420	1289820	кстати, есть такая конструкция.

1290840	1293440	И работает она, по тем же, принципам, что термитника.

1293920	1295980	Это ветра уловитель и ботгир,

1296400	1299320	который из-за прилив в древней персе еще несколько тысяч лет назад.

1299660	1306340	Это вертикальная башня буквально ловит ветер и помогает ему вытягивать холодные ночные воздуха из-подвала или резерву аросвадой.

1307000	1308120	Вот, а время горячий воздух,

1308580	1311220	доходит из верхушки ботгиры прямо как в термитнике.

1311560	1314740	В результате, в доме, на 10 градусов в холоднее,

1314960	1315600	ну, локс, только хорошо.

1316020	1317860	Древние персы пришли к этому.

1317960	1319360	Медан персисского тека.

1319760	1321240	Но 30 лет назад мы, к чему,

1321920	1324600	к праве, на спею термитов и хидеи.

1325340	1326100	Ну,

1326580	1326820	да,

1327820	1329460	кинуть туда не много современных тихо.

1330040	1331740	А конкретно, 2 вентилятора.

1331960	1337300	Ты 61 году архитектор Майк Пирс построил бизнес-центр самый крупный зимвабы.

1337540	1340100	Майк спректировал офис из бетонных блоков,

1340220	1341360	который ночью запасали холод,

1341580	1344420	отъем тепло, чтобы это происходило быстрее в основании здания,

1344520	1346220	напостаяло пару слабых вентиляторов,

1346500	1348080	которые из-за осоволевосдух внутрь.

1348300	1350820	И окна Майк тоже сделал какую термитов маленькими,

1351000	1352660	чтобы не терять драгоценный ветерок.

1352960	1354400	Но можем ли мы пойти ещё дальше?

1355060	1358160	Да, да, можем, конечно, может быть, место, чтобы строить как термиты.

1358840	1361360	Мы заставим самих термитов для нас строить.

1362000	1362380	А как он?

1362840	1364960	Американский стартап-тармесс так и сделал,

1365520	1365660	да,

1366060	1367660	роботы не очень похожи на на секомах,

1367700	1369080	но посмысло один в один.

1369640	1370780	Вы как термитой инсатор?

1371040	1372120	Кладёте первый блок,

1372280	1374660	а все, что остаются роботом, это класс своей блоки рядом.

1374920	1375760	Вот и вся инструкция,

1376040	1379020	но ее хватает, чтобы строить маленький небоскребы,

1379420	1381140	вы скажете, даже проще построить самому.

1381500	1385280	Если бы с окону возьми к раантом или там не знаю, бетона насос.

1385740	1390200	Все так, да, ну попробуйте доставить бетона насос на морсь.

1390640	1391900	А вот роботов запросто,

1392320	1396320	из местного песка, роботы сделают себе блоки и как на 3D принтери,

1396340	1397760	напечатают здания по слоям.

1397960	1400700	А если нужно, они сальются в одного большого робота,

1400760	1402480	чтобы, например, то оскать большие блоки,

1402760	1407060	или из песка, делать подобие бетона из-заливатим фундамент.

1407400	1410640	Так что получается термитный интеллект самый совершеный.

1411680	1412260	Ну как сказать,

1414520	1415740	термиты отлично и строители,

1416200	1419440	но большую часть времени они просто валяются под конецанером,

1420600	1421920	которые сами же и построили.

1422180	1423880	В этом смысле они напоминают копебор.

1424120	1425800	Или как тайцев,

1426300	1427520	спящий на снегу.

1428000	1428340	Но что,

1428840	1430380	если строить раевой интеллект,

1430720	1434100	и существо, которые не просто выполняют команды,

1434300	1437040	но еще и активно адаптироваться к миру обучают друг друга.

1437520	1440860	То есть раньше мы строили интеллект буквально и ступиться,

1441440	1442840	а сейчас будем из умников,

1443160	1443760	а как у мыде.

1443880	1445420	Такой раевой интеллект уже есть,

1445880	1448140	а нём знал еще пещерный человек.

1448480	1449220	И не просто знал.

1449780	1451300	Но еще и активно и него эксплуатировал.

1452000	1454960	Это его на сканемую рисунку около 8 тысяч лет.

1455680	1460140	Здесь хомасапен, с корзинкой, коробка и цена дерева попытка задавать некий сладкий серол.

1460560	1462220	А вокруг не волитает роль существ,

1462400	1463620	который этот сероп произвели.

1464120	1465000	И конечно же вы догадались.

1465920	1468040	Сиропа тамет, а раевой интеллект это пчелы.

1473790	1479160	Одно на секу мы за всю жизнь произведет не больше вот такой ложки меда.

1479500	1481360	Но что получить вот такой банку?

1481860	1482380	Тысячи пчел,

1482820	1486680	параллители больше 50 тысяч квитров собрать нектор с миллиона цветов,

1486740	1489080	переварили внутри своего зоба и отрегнули в соты.

1489960	1493900	Вот, насколько это заморочный процесс ради вот такой банчки.

1494740	1495940	Челы такие же социальные,

1496100	1497260	как муравии или термиты,

1497480	1499840	но у них есть раз этой зрения крыд для полета.

1500380	1502880	Так что живут они не в плоской мире пекмана.

1503440	1503540	Авториде,

1504280	1506740	в добавок пчелы и видят в ультрифе олятие,

1506800	1510400	поэтому цветки для них буквально это посадочные полы, которые так окричат,

1510880	1512120	садись сюда обратиться здесь.

1512620	1515000	Мы решения это проверить, взяли несколько букетов,

1515460	1516940	ультрифе олятерифаналь и камеру,

1517260	1518540	который видит в ультрифе олятие.

1518640	1519640	Итак, давайте посмотрим,

1520260	1522340	как эти букеты видят в челы,

1522680	1525520	в пацеллных охране замочет яркую свечащуюся пельцу.

1525900	1528280	На ирисах увидит пылоса от рисунок на лепестках,

1528460	1531280	но лучше всего их зрения и предают профессиональные свемка.

1531420	1531720	Видно,

1531780	1533240	что некоторые цветы для пчеллы,

1533260	1535080	от целые свечащиеся галактики.

1535140	1536220	Запомните этот факт,

1536380	1537700	а лучше заскриньте его,

1537840	1540440	чтобы пересказать его близким и показать, когда будете дарить

1540840	1543400	цветы, но а здаставкой заказать их можно.

1543880	1544740	На флалуал.

1544920	1545980	Также, как идики пчел,

1546320	1547700	обретаются и по всему миру,

1547840	1549480	кроме крайнейой северо и сахары.

1549560	1553580	Так и флалуал доставляют цветы и подарки во всех климатических зонах.

1553700	1556200	Доставить букет знаком к ритт инвесторов Dubai,

1556360	1557760	ваши девушки в табилисе,

